{
  "fixture_version": "1.0.0",
  "id": "melodies/waltz_suspensions",
  "title": "Melody in 3/4 built on prepared suspensions",
  "description": "Accented downbeat dissonances resolving down by step. Exercises suspension versus appoggiatura classification, metric weighting in 3/4, and common-practice voice leading.",
  "tempo_bpm": 96.0,
  "time_signature": "3/4",
  "tempo_map": [
    {
      "qn": "0",
      "bpm": 96.0,
      "linear": false
    }
  ],
  "meter_map": [
    {
      "qn": "0",
      "sig": "3/4",
      "measure": 0
    }
  ],
  "loop": {
    "start_qn": "0",
    "end_qn": "24",
    "intent": "closed_tonic"
  },
  "key_hint": {
    "tonic": "C",
    "scale_id": "major"
  },
  "notes": [
    {
      "pitch": "G4",
      "onset": "0",
      "duration": "1",
      "velocity": 96,
      "channel": 0,
      "muted": false,
      "selected": true,
      "voice": 0,
      "role": "melody"
    },
    {
      "pitch": "F4",
      "onset": "1",
      "duration": "2",
      "velocity": 96,
      "channel": 0,
      "muted": false,
      "selected": true,
      "voice": 0,
      "role": "melody"
    },
    {
      "pitch": "E4",
      "onset": "3",
      "duration": "3",
      "velocity": 96,
      "channel": 0,
      "muted": false,
      "selected": true,
      "voice": 0,
      "role": "melody"
    },
    {
      "pitch": "A4",
      "onset": "6",
      "duration": "1",
      "velocity": 96,
      "channel": 0,
      "muted": false,
      "selected": true,
      "voice": 0,
      "role": "melody"
    },
    {
      "pitch": "G4",
      "onset": "7",
      "duration": "2",
      "velocity": 96,
      "channel": 0,
      "muted": false,
      "selected": true,
      "voice": 0,
      "role": "melody"
    },
    {
      "pitch": "F4",
      "onset": "9",
      "duration": "3",
      "velocity": 96,
      "channel": 0,
      "muted": false,
      "selected": true,
      "voice": 0,
      "role": "melody"
    },
    {
      "pitch": "F4",
      "onset": "12",
      "duration": "1",
      "velocity": 96,
      "channel": 0,
      "muted": false,
      "selected": true,
      "voice": 0,
      "role": "melody"
    },
    {
      "pitch": "E4",
      "onset": "13",
      "duration": "2",
      "velocity": 96,
      "channel": 0,
      "muted": false,
      "selected": true,
      "voice": 0,
      "role": "melody"
    },
    {
      "pitch": "D4",
      "onset": "15",
      "duration": "3",
      "velocity": 96,
      "channel": 0,
      "muted": false,
      "selected": true,
      "voice": 0,
      "role": "melody"
    },
    {
      "pitch": "D4",
      "onset": "18",
      "duration": "3",
      "velocity": 96,
      "channel": 0,
      "muted": false,
      "selected": true,
      "voice": 0,
      "role": "melody"
    },
    {
      "pitch": "C4",
      "onset": "21",
      "duration": "3",
      "velocity": 96,
      "channel": 0,
      "muted": false,
      "selected": true,
      "voice": 0,
      "role": "melody"
    }
  ]
}
