{
  "fixture_version": "1.0.0",
  "id": "melodies/blues_head_c",
  "title": "Four-bar blues head in C",
  "description": "Blue third and flat five over a C blues context. Under the blues profile C7 must be treated as stable tonic harmony rather than a dominant demanding resolution.",
  "tempo_bpm": 92.0,
  "time_signature": "4/4",
  "tempo_map": [
    {
      "qn": "0",
      "bpm": 92.0,
      "linear": false
    }
  ],
  "meter_map": [
    {
      "qn": "0",
      "sig": "4/4",
      "measure": 0
    }
  ],
  "loop": {
    "start_qn": "0",
    "end_qn": "16",
    "intent": "seamless_color"
  },
  "key_hint": {
    "tonic": "C",
    "scale_id": "blues_minor"
  },
  "notes": [
    {
      "pitch": "C4",
      "onset": "0",
      "duration": "1/2",
      "velocity": 96,
      "channel": 0,
      "muted": false,
      "selected": true,
      "voice": 0,
      "role": "melody"
    },
    {
      "pitch": "Eb4",
      "onset": "1/2",
      "duration": "1/2",
      "velocity": 96,
      "channel": 0,
      "muted": false,
      "selected": true,
      "voice": 0,
      "role": "melody"
    },
    {
      "pitch": "F4",
      "onset": "1",
      "duration": "1/2",
      "velocity": 96,
      "channel": 0,
      "muted": false,
      "selected": true,
      "voice": 0,
      "role": "melody"
    },
    {
      "pitch": "Gb4",
      "onset": "3/2",
      "duration": "1/2",
      "velocity": 96,
      "channel": 0,
      "muted": false,
      "selected": true,
      "voice": 0,
      "role": "melody"
    },
    {
      "pitch": "G4",
      "onset": "2",
      "duration": "1",
      "velocity": 96,
      "channel": 0,
      "muted": false,
      "selected": true,
      "voice": 0,
      "role": "melody"
    },
    {
      "pitch": "Bb4",
      "onset": "3",
      "duration": "1",
      "velocity": 96,
      "channel": 0,
      "muted": false,
      "selected": true,
      "voice": 0,
      "role": "melody"
    },
    {
      "pitch": "C5",
      "onset": "4",
      "duration": "2",
      "velocity": 96,
      "channel": 0,
      "muted": false,
      "selected": true,
      "voice": 0,
      "role": "melody"
    },
    {
      "pitch": "Bb4",
      "onset": "6",
      "duration": "1",
      "velocity": 96,
      "channel": 0,
      "muted": false,
      "selected": true,
      "voice": 0,
      "role": "melody"
    },
    {
      "pitch": "G4",
      "onset": "7",
      "duration": "1",
      "velocity": 96,
      "channel": 0,
      "muted": false,
      "selected": true,
      "voice": 0,
      "role": "melody"
    },
    {
      "pitch": "F4",
      "onset": "8",
      "duration": "1",
      "velocity": 96,
      "channel": 0,
      "muted": false,
      "selected": true,
      "voice": 0,
      "role": "melody"
    },
    {
      "pitch": "Eb4",
      "onset": "9",
      "duration": "1/2",
      "velocity": 96,
      "channel": 0,
      "muted": false,
      "selected": true,
      "voice": 0,
      "role": "melody"
    },
    {
      "pitch": "C4",
      "onset": "19/2",
      "duration": "3/2",
      "velocity": 96,
      "channel": 0,
      "muted": false,
      "selected": true,
      "voice": 0,
      "role": "melody"
    },
    {
      "pitch": "C4",
      "onset": "11",
      "duration": "1",
      "velocity": 96,
      "channel": 0,
      "muted": false,
      "selected": true,
      "voice": 0,
      "role": "melody"
    },
    {
      "pitch": "G4",
      "onset": "12",
      "duration": "1",
      "velocity": 96,
      "channel": 0,
      "muted": false,
      "selected": true,
      "voice": 0,
      "role": "melody"
    },
    {
      "pitch": "F4",
      "onset": "13",
      "duration": "1",
      "velocity": 96,
      "channel": 0,
      "muted": false,
      "selected": true,
      "voice": 0,
      "role": "melody"
    },
    {
      "pitch": "Eb4",
      "onset": "14",
      "duration": "1",
      "velocity": 96,
      "channel": 0,
      "muted": false,
      "selected": true,
      "voice": 0,
      "role": "melody"
    },
    {
      "pitch": "C4",
      "onset": "15",
      "duration": "1",
      "velocity": 96,
      "channel": 0,
      "muted": false,
      "selected": true,
      "voice": 0,
      "role": "melody"
    }
  ]
}
