{
  "fixture_version": "1.0.0",
  "id": "melodies/chromatic_descent",
  "title": "Melody with chromatic descent and applied-dominant implication",
  "description": "A Bb over a C centre implies a backdoor or applied dominant; the chromatic descent Eb-D-Db-C invites chromatic and bass-led reharmonisation. Used to check that chromatic material is not forced into a diatonic label.",
  "tempo_bpm": 100.0,
  "time_signature": "4/4",
  "tempo_map": [
    {
      "qn": "0",
      "bpm": 100.0,
      "linear": false
    }
  ],
  "meter_map": [
    {
      "qn": "0",
      "sig": "4/4",
      "measure": 0
    }
  ],
  "loop": {
    "start_qn": "0",
    "end_qn": "16",
    "intent": "open_dominant"
  },
  "notes": [
    {
      "pitch": "C4",
      "onset": "0",
      "duration": "1",
      "velocity": 96,
      "channel": 0,
      "muted": false,
      "selected": true,
      "voice": 0,
      "role": "melody"
    },
    {
      "pitch": "E4",
      "onset": "1",
      "duration": "1",
      "velocity": 96,
      "channel": 0,
      "muted": false,
      "selected": true,
      "voice": 0,
      "role": "melody"
    },
    {
      "pitch": "G4",
      "onset": "2",
      "duration": "1",
      "velocity": 96,
      "channel": 0,
      "muted": false,
      "selected": true,
      "voice": 0,
      "role": "melody"
    },
    {
      "pitch": "Bb4",
      "onset": "3",
      "duration": "1",
      "velocity": 96,
      "channel": 0,
      "muted": false,
      "selected": true,
      "voice": 0,
      "role": "melody"
    },
    {
      "pitch": "A4",
      "onset": "4",
      "duration": "1",
      "velocity": 96,
      "channel": 0,
      "muted": false,
      "selected": true,
      "voice": 0,
      "role": "melody"
    },
    {
      "pitch": "C5",
      "onset": "5",
      "duration": "1",
      "velocity": 96,
      "channel": 0,
      "muted": false,
      "selected": true,
      "voice": 0,
      "role": "melody"
    },
    {
      "pitch": "E5",
      "onset": "6",
      "duration": "2",
      "velocity": 96,
      "channel": 0,
      "muted": false,
      "selected": true,
      "voice": 0,
      "role": "melody"
    },
    {
      "pitch": "Eb5",
      "onset": "8",
      "duration": "1",
      "velocity": 96,
      "channel": 0,
      "muted": false,
      "selected": true,
      "voice": 0,
      "role": "melody"
    },
    {
      "pitch": "D5",
      "onset": "9",
      "duration": "1",
      "velocity": 96,
      "channel": 0,
      "muted": false,
      "selected": true,
      "voice": 0,
      "role": "melody"
    },
    {
      "pitch": "Db5",
      "onset": "10",
      "duration": "1",
      "velocity": 96,
      "channel": 0,
      "muted": false,
      "selected": true,
      "voice": 0,
      "role": "melody"
    },
    {
      "pitch": "C5",
      "onset": "11",
      "duration": "1",
      "velocity": 96,
      "channel": 0,
      "muted": false,
      "selected": true,
      "voice": 0,
      "role": "melody"
    },
    {
      "pitch": "B4",
      "onset": "12",
      "duration": "1",
      "velocity": 96,
      "channel": 0,
      "muted": false,
      "selected": true,
      "voice": 0,
      "role": "melody"
    },
    {
      "pitch": "D5",
      "onset": "13",
      "duration": "1",
      "velocity": 96,
      "channel": 0,
      "muted": false,
      "selected": true,
      "voice": 0,
      "role": "melody"
    },
    {
      "pitch": "G4",
      "onset": "14",
      "duration": "2",
      "velocity": 96,
      "channel": 0,
      "muted": false,
      "selected": true,
      "voice": 0,
      "role": "melody"
    }
  ]
}
